[
  {
    "candidate_id": "SCNC-DC-CLOSE-LATE-PRESENTMENT",
    "proposed_scenario_id": "SCN-DC-CLOSE-LATE-PRESENTMENT",
    "status": "approved_for_mvp",
    "title": "Закрытие счёта после позднего предъявления операции",
    "case_topic": "Дебетовые карты",
    "case_subtopics": ["Закрытие счёта"],
    "description": "Стратегия разделяет долг клиента и техническую комиссию при позднем предъявлении покупки после заявления на закрытие.",
    "trigger_conditions": ["closure_check_code=ACCOUNT_BALANCE_NOT_ZERO", "late presentment присутствует", "fee event присутствует"],
    "required_inputs": ["account_id", "authorization_events", "ledger_balance", "fee_events"],
    "strategy_steps": [
      {"order": 1, "action": "trace_card_transaction", "description": "Связать авторизацию с поздним предъявлением.", "expertise_type": "card_transaction_status_check"},
      {"order": 2, "action": "analyze_balance_components", "description": "Разделить клиентское обязательство и техническую комиссию.", "expertise_type": "account_balance_analysis"},
      {"order": 3, "action": "prepare_resolution_decision", "description": "Подготовить сумму урегулирования и повторную проверку закрытия.", "expertise_type": null}
    ],
    "allowed_expertises": ["card_transaction_status_check", "account_balance_analysis"],
    "stop_conditions": ["late presentment not confirmed", "manual reconciliation required"],
    "source_case_ids": ["HIST-DC-004"],
    "evidence_count": 1,
    "evidence_strength": "single_case",
    "review_recommendation": "needs_more_evidence",
    "planning_supported": true,
    "execution_supported": true,
    "required_new_actions": ["trace_card_transaction", "analyze_balance_components", "prepare_resolution_decision"]
  },
  {
    "candidate_id": "SCNC-DC-CLOSE-OUTSTANDING-ITEMS",
    "proposed_scenario_id": "SCN-DC-CLOSE-OUTSTANDING-ITEMS",
    "status": "approved_for_mvp",
    "title": "Закрытие счёта с несколькими незавершёнными элементами",
    "case_topic": "Дебетовые карты",
    "case_subtopics": ["Закрытие счёта"],
    "description": "Стратегия ставит закрытие на ожидание, собирает все изменяющие остаток элементы и повторяет проверку после их завершения.",
    "trigger_conditions": ["closure_check_code=MULTIPLE_OUTSTANDING_ITEMS"],
    "required_inputs": ["account_id", "pending_operations", "ledger_balance"],
    "strategy_steps": [
      {"order": 1, "action": "assess_closure_readiness", "description": "Выявить все незавершённые элементы.", "expertise_type": "account_closure_readiness_check"},
      {"order": 2, "action": "wait_for_settlement", "description": "Зафиксировать ожидание без новых клиентских операций.", "expertise_type": null},
      {"order": 3, "action": "reconcile_final_balance", "description": "Рассчитать окончательный остаток и повторить проверку.", "expertise_type": "account_balance_analysis"}
    ],
    "allowed_expertises": ["account_closure_readiness_check", "account_balance_analysis"],
    "stop_conditions": ["new operation detected", "manual settlement required"],
    "source_case_ids": ["HIST-DC-005"],
    "evidence_count": 1,
    "evidence_strength": "single_case",
    "review_recommendation": "needs_more_evidence",
    "planning_supported": true,
    "execution_supported": true,
    "required_new_actions": ["assess_closure_readiness", "wait_for_settlement", "reconcile_final_balance"]
  },
  {
    "candidate_id": "SCNC-DC-CLOSE-OPEN-DISPUTE",
    "proposed_scenario_id": "SCN-DC-CLOSE-OPEN-DISPUTE",
    "status": "approved_for_mvp",
    "title": "Закрытие счёта с сохранением обслуживания открытого спора",
    "case_topic": "Дебетовые карты",
    "case_subtopics": ["Закрытие счёта"],
    "description": "Стратегия отделяет закрытие продукта от обслуживания открытого спора и заранее фиксирует инструкцию для будущего результата.",
    "trigger_conditions": ["closure_check_code=OPEN_DISPUTE_SERVICING_REQUIRED"],
    "required_inputs": ["account_id", "open_disputes", "settlement_instruction"],
    "strategy_steps": [
      {"order": 1, "action": "assess_closure_readiness", "description": "Определить требования к обслуживанию открытого спора.", "expertise_type": "account_closure_readiness_check"},
      {"order": 2, "action": "record_post_closure_instruction", "description": "Зафиксировать инструкцию для результата спора.", "expertise_type": null},
      {"order": 3, "action": "monitor_dispute_outcome", "description": "Завершить запись сопровождения после результата спора.", "expertise_type": "card_transaction_status_check"}
    ],
    "allowed_expertises": ["account_closure_readiness_check", "card_transaction_status_check"],
    "stop_conditions": ["settlement instruction missing", "dispute servicing unsupported"],
    "source_case_ids": ["HIST-DC-006"],
    "evidence_count": 1,
    "evidence_strength": "single_case",
    "review_recommendation": "needs_more_evidence",
    "planning_supported": true,
    "execution_supported": true,
    "required_new_actions": ["assess_closure_readiness", "record_post_closure_instruction", "monitor_dispute_outcome"]
  },
  {
    "candidate_id": "SCNC-DC-REFUND-TRACE",
    "proposed_scenario_id": "SCN-DC-REFUND-TRACE",
    "status": "approved_for_mvp",
    "title": "Трассировка и квалификация возврата",
    "case_topic": "Дебетовые карты",
    "case_subtopics": ["Возврат по карточной операции"],
    "description": "Стратегия связывает покупку и возврат по референсам, различает неполный, уже зачисленный и ещё проводящийся возврат.",
    "trigger_conditions": ["service_issue_code относится к refund lifecycle"],
    "required_inputs": ["transaction_id", "merchant_references", "refund_events", "ledger_entries"],
    "strategy_steps": [
      {"order": 1, "action": "trace_refund", "description": "Сопоставить покупку, подтверждение продавца и события возврата.", "expertise_type": "refund_trace_check"},
      {"order": 2, "action": "classify_refund_state", "description": "Определить: missing, posted, mislinked или pending.", "expertise_type": "card_transaction_status_check"},
      {"order": 3, "action": "qualify_dispute", "description": "Открывать спор только на подтверждённо недостающую сумму.", "expertise_type": "dispute_qualification_check"},
      {"order": 4, "action": "prepare_resolution_decision", "description": "Предложить credit, relink, ожидание либо закрытие без выплаты.", "expertise_type": null}
    ],
    "allowed_expertises": ["refund_trace_check", "card_transaction_status_check", "dispute_qualification_check"],
    "stop_conditions": ["refund references missing", "conflicting ledger entries"],
    "source_case_ids": ["HIST-DC-007", "HIST-DC-025", "HIST-DC-027"],
    "evidence_count": 3,
    "evidence_strength": "strong",
    "review_recommendation": "review_branches",
    "planning_supported": true,
    "execution_supported": true,
    "required_new_actions": ["trace_refund", "classify_refund_state", "qualify_dispute", "prepare_resolution_decision"]
  },
  {
    "candidate_id": "SCNC-DC-HOLD-RESOLUTION",
    "proposed_scenario_id": "SCN-DC-HOLD-RESOLUTION",
    "status": "approved_for_mvp",
    "title": "Разрешение зависшего холда или реверса",
    "case_topic": "Дебетовые карты",
    "case_subtopics": ["Холд и предавторизация", "Неуспешный реверс"],
    "description": "Стратегия связывает авторизацию, списание и reversal, после чего выбирает обоснованный release либо ожидание штатного expiry.",
    "trigger_conditions": ["service_issue_code относится к hold или reversal", "authorization remains active"],
    "required_inputs": ["authorization_events", "presentment_events", "reversal_events", "available_balance"],
    "strategy_steps": [
      {"order": 1, "action": "trace_card_transaction", "description": "Связать авторизацию, итоговый дебет и reversal.", "expertise_type": "card_transaction_status_check"},
      {"order": 2, "action": "assess_hold_release", "description": "Проверить основание для ручного release.", "expertise_type": "account_balance_analysis"},
      {"order": 3, "action": "prepare_resolution_decision", "description": "Предложить release или мониторинг до expiry.", "expertise_type": null}
    ],
    "allowed_expertises": ["card_transaction_status_check", "account_balance_analysis"],
    "stop_conditions": ["late presentment risk", "reversal validity not confirmed"],
    "source_case_ids": ["HIST-DC-008", "HIST-DC-024", "HIST-DC-032"],
    "evidence_count": 3,
    "evidence_strength": "strong",
    "review_recommendation": "review_branches",
    "planning_supported": true,
    "execution_supported": true,
    "required_new_actions": ["trace_card_transaction", "assess_hold_release", "prepare_resolution_decision"]
  },
  {
    "candidate_id": "SCNC-DC-ATM-EXCEPTION",
    "proposed_scenario_id": "SCN-DC-ATM-EXCEPTION",
    "status": "approved_for_mvp",
    "title": "Расследование спорной операции в банкомате",
    "case_topic": "Дебетовые карты",
    "case_subtopics": ["Операция в банкомате"],
    "description": "Стратегия сверяет проводку с журналом банкомата и кассовой сверкой, поддерживая как возмещение, так и мотивированный отказ.",
    "trigger_conditions": ["service_issue_code относится к ATM dispense"],
    "required_inputs": ["atm_id", "transaction_id", "atm_journal", "cash_reconciliation"],
    "strategy_steps": [
      {"order": 1, "action": "investigate_atm_exception", "description": "Получить журнал устройства и результат кассовой сверки.", "expertise_type": "atm_exception_investigation"},
      {"order": 2, "action": "assess_dispute_evidence", "description": "Сопоставить технические данные и показания клиента.", "expertise_type": "dispute_evidence_assessment"},
      {"order": 3, "action": "prepare_resolution_decision", "description": "Предложить recredit либо мотивированное закрытие без выплаты.", "expertise_type": null}
    ],
    "allowed_expertises": ["atm_exception_investigation", "dispute_evidence_assessment"],
    "stop_conditions": ["atm journal unavailable", "cash reconciliation pending"],